{
  "contract": "star-armada/visual-pack",
  "contract_major": 1,
  "id": "example:alt_frigate",
  "name": "Example: alternative frigate",
  "version": "1.0.0",
  "requires": {
    "min_engine": "0.15.1",
    "contracts": [
      "star-armada/visual-pack/v1",
      "star-armada/model-manifest/v1"
    ]
  },
  "content": {
    "replaces": [
      {
        "binding": "rebel:frigate",
        "manifest": "assets/models/alt_frigate.json",
        "replace_of": "core:alliance/frigate"
      }
    ]
  },
  "roots": {
    "assets": "assets"
  },
  "notes": "Example replacement pack: the same binding core defines, one pack-local manifest, nothing else."
}
